{"$schema":"https://json-schema.org/draft/2020-12/schema","$id":"https://jichi-insight.example/schemas/kagawa_extended_plan_indicator_review_manifest.schema.json","title":"Kagawa extended plan indicator review manifest","type":"object","additionalProperties":false,"required":["id","prefecture_code","municipality_key","plan_title","plan_period","source_url","source_document_title","reviewed_indicator_count","display_occurrence_count","evidence_packet_count","reposted_indicator_count","reposted_indicator_numbers","indicators_with_current_value_count","target_revision_count","policy_achievement_assessed_indicator_count","status","updated_at","next_review_scope","quality_note"],"properties":{"id":{"const":"kagawa-extended-plan-indicator-review-manifest"},"prefecture_code":{"const":"37"},"municipality_key":{"const":"kagawa-prefecture"},"plan_title":{"type":"string","minLength":1},"plan_period":{"const":"令和3年度～令和8年度"},"source_url":{"type":"string","format":"uri"},"source_document_title":{"type":"string","minLength":1},"reviewed_indicator_count":{"const":135},"display_occurrence_count":{"const":141},"evidence_packet_count":{"const":135},"reposted_indicator_count":{"const":6},"reposted_indicator_numbers":{"const":[7,14,50,66,67,96]},"indicators_with_current_value_count":{"const":135},"target_revision_count":{"const":87},"policy_achievement_assessed_indicator_count":{"const":0},"status":{"const":"complete"},"updated_at":{"type":"string","format":"date"},"next_review_scope":{"type":"string","minLength":1},"quality_note":{"type":"string","minLength":1}}}