{"id":"kagawa-extended-plan-indicator-review-manifest","prefecture_code":"37","municipality_key":"kagawa-prefecture","plan_title":"「人生100年時代のフロンティア県・香川」実現計画","plan_period":"令和3年度～令和8年度","source_url":"https://www.pref.kagawa.lg.jp/documents/36520/shiryou3_shihyouminaoshi.pdf","source_document_title":"計画期間の延長及び指標の目標値等の見直しについて","reviewed_indicator_count":135,"display_occurrence_count":141,"evidence_packet_count":135,"reposted_indicator_count":6,"reposted_indicator_numbers":[7,14,50,66,67,96],"indicators_with_current_value_count":135,"target_revision_count":87,"policy_achievement_assessed_indicator_count":0,"status":"complete","updated_at":"2026-07-22","next_review_scope":"行政評価報告書と年度実績を、延長後の令和8年度目標へ定義照合して接続する。","quality_note":"令和7年度目標と令和8年度目標を分離し、再掲6指標は表示位置を保持しつつ固有指標数へ重複計上しない。135番の県人口は令和12年目標として保持する。"}